{
  "schemaVersion": 1,
  "generatedFrom": [
    ".devview/blueprint/requirement-tree.json",
    ".devview/blueprint/work-design.json",
    ".devview/blueprint/work-roadmap.md"
  ],
  "verificationItems": [
    {
      "id": "verify-001",
      "workDesignId": "work-001",
      "taskId": "TASK-001",
      "requirementNodeId": "req-root",
      "requirementIds": ["req-root"],
      "title": "Verify confirmed requirement",
      "acceptanceCriteria": [],
      "validationCommands": [],
      "manualChecks": [],
      "uiUxIds": [],
      "uiUxEvidenceRequired": [],
      "regressionRisks": [],
      "evidenceToCapture": []
    }
  ],
  "acceptancePlan": {
    "summary": "",
    "requiredEvidence": [],
    "stopConditions": []
  }
}
